<?xml version="1.0" encoding="UTF-8"?>
<!DOCTYPE parque SYSTEM "XML_Errores.dtd">
<parque nombre="Aventura Feliz" ciudad="Madrid" apertura="1998-06-15">

  <zonas>
    <zona id="z_aventura" nombre="Zona Aventura" tematica="selva" estado="abierta">
      <descripcion>Área con atracciones fuertes y tematización tropical.</descripcion>

      <atraccionRef>a_001</atraccionRef>
      <atraccionRef>a_002</atraccionRef>

      <restauranteRef>r_001</restauranteRef>

      <empleadoRef>e_001</empleadoRef>
      <empleadoRef>e_002</empleadoRef>
    </zona>

    <zona id="z_fantasia" nombre="Zona Fantasía" tematica="cuento" estado="abierta">
      <descripcion>Zona familiar con personajes, música y colores.</descripcion>

      <atraccionRef>a_003</atraccionRef>
      <atraccionRef>a_004</atraccionRef>

      <restauranteRef>r_002</restauranteRef>

      <empleadoRef>e_003</empleadoRef>
    </zona>

    <zona id="z_agua" nombre="Zona Agua" tematica="océano" estado="mantenimiento">
      <descripcion>Zona de agua con toboganes y espectáculos marinos.</descripcion>

      <atraccionRef>a_005</atraccionRef>
      <atraccionRef>a_006</atraccionRef>

      <restauranteRef>r_003</restauranteRef>
      
      <empleadoRef>e_004</empleadoRef>
      <empleadoRef>e_005</empleadoRef>
    </zona>

    <zona id="z_terror" nombre="Zona Terror" tematica="horror" estado="cerradísima">
      <descripcion>Espacios oscuros, sustos y ambientación nocturna.</descripcion>

      <atraccionRef>a_007</atraccionRef>
      <atraccionRef>a_008</atraccionRef>

      <restauranteRef>r_004</restauranteRef>

      <empleadoRef>e_006</empleadoRef>
    </zona>

    <zona id="z_futuro" nombre="Zona Futuro" tematica="robots" estado="abierta">
      <descripcion>Experiencias futuristas y simuladores avanzados.</descripcion>

      <atraccionRef>a_009</atraccionRef>

      <restauranteRef>r_005</restauranteRef>

      <empleadoRef>e_007</empleadoRef>
    </zona>

    <zona id="z_infantil" nombre="Zona Infantil" tematica="juguetes" estado="abierta">
      <descripcion>Espacio para niños pequeños con atracciones suaves.</descripcion>

      <atraccionRef>a_010</atraccionRef>
      <atraccionRef>a_011</atraccionRef>

      <restauranteRef>r_006</restauranteRef>
      
      <empleadoRef>e_008</empleadoRef>
      <empleadoRef>e_009</empleadoRef>
    </zona>

    <zona id="z_oeste" nombre="Zona Oeste" tematica="western" estado="cerrada">
      <descripcion>Pueblo vaquero con tren y duelos teatrales.</descripcion>

      <atraccionRef>a_012</atraccionRef>

      <restauranteRef>r_007</restauranteRef>

      <empleadoRef>e_010</empleadoRef>
    </zona>
  </zonas> 

  <atracciones>

    <atraccion id="a_001" zona="z_aventura" intensidad="alta">
      <nombre>Montaña Rápida</nombre>
      <tipo>montaña rusa</tipo>
      <alturaMinima>140</alturaMinima>
      <capacidad>24</capacidad>
      <estado>operativa</estado>
      <tiempoEspera>35</tiempoEspera>
      <premios>
        <premio>Experiencia extrema</premio>
      </premios>

    </atraccion>

    <atraccion id="a_002" zona="z_aventura" intensidad="extrema">
      <nombre>Torre del Vértigo</nombre>
      <tipo>caída libre</tipo>
      <alturaMinima>145</alturaMinima>
      <capacidad>16</capacidad>
      <estado>operativa</estado>
      <tiempoEspera>50</tiempoEspera>
    </atraccion>

    <atraccion id="a_003" zona="z_fantasia" intensidad="baja">
      <nombre>Carrusel Mágico</nombre>
      <tipo>carrusel</tipo>
      <alturaMinima>90</alturaMinima>
      <capacidad>40</capacidad>
      <estado>operativa</estado>
      <tiempoEspera>10</tiempoEspera>
    </atraccion>

    <atraccion id="a_004" zona="z_fantasia" intensidad="media">
      <nombre>Vuelo del Dragón</nombre>
      <tipo>tren aéreo</tipo>
      <alturaMinima>120</alturaMinima>
      <capacidad>20</capacidad>
      <estado>revisión</estado>
      <tiempoEspera>20</tiempoEspera>
      <premios>
        <premio>Favorita familiar</premio>
        <premio>Mejor tematización 2024</premio>
      </premios>
    </atraccion>
    
    <atraccion id="a_005" zona="z_agua" intensidad="alta">
      <nombre>Río Salvaje</nombre>
      <tipo>rápidos</tipo>
      <alturaMinima>130</alturaMinima>
      <capacidad>12</capacidad>
      <estado>mantenimiento</estado>
      <tiempoEspera>0</tiempoEspera>
    </atraccion>

    <atraccion id="a_006" zona="z_agua" intensidad="media">
      <nombre>Tsunami Splash</nombre>       <tipo>barca</tipo>
      <alturaMinima>125</alturaMinima>
      <capacidad>18</capacidad>       <estado>operativa</estado>
      <tiempoEspera>28</tiempoEspera>     </atraccion>
    <atraccion id="a_007" zona="z_terror" intensidad="alta">
      <nombre>Casa Maldita</nombre>       <tipo>pasaje del terror</tipo>
      <alturaMinima>110</alturaMinima>
      <capacidad>30</capacidad>       <estado>cerrada</estado>
      <tiempoEspera>5</tiempoEspera>     </atraccion>
    <atraccion id="a_008" zona="z_terror" intensidad="ultra">
      <nombre>Labertinto Oscuro</nombre>
      <tipo>maze</tipo>       <alturaMinima>115</alturaMinima>
      <capacidad>22</capacidad>       <estado>operativa</estado>
      <tiempoEspera>18</tiempoEspera>     </atraccion>
    <atraccion id="a_009" zona="z_futuro" intensidad="media">
      <nombre>Simulador Galáctico</nombre>
      <tipo>simulador</tipo>       <alturaMinima>130</alturaMinima>
      <capacidad>50</capacidad>       <estado>operativa</estado>
      <tiempoEspera>40</tiempoEspera>     </atraccion>
    <atraccion id="a_010" zona="z_infantil" intensidad="baja">
      <nombre>Tazas Giratorias</nombre>
      <tipo>tazas</tipo>       <alturaMinima>80</alturaMinima>
      <capacidad>25</capacidad>       <estado>operativa</estado>
      <tiempoEspera>12</tiempoEspera>     </atraccion>
    <atraccion id="a_011" zona="z_infantil" intensidad="baja">
      <nombre>Mini Tren</nombre>       <tipo>tren</tipo>       <alturaMinima>70</alturaMinima>
      <capacidad>30</capacidad>       <estado>operativa</estado>
      <tiempoEspera>8</tiempoEspera>     </atraccion>
    <atraccion id="a_012" zona="z_oeste" intensidad="media">
      <nombre>Tren Minero</nombre>       <tipo>montaña rusa familiar</tipo>
      <alturaMinima>120</alturaMinima>
      <capacidad>28</capacidad>       <estado>cerrada</estado>
      <tiempoEspera>0</tiempoEspera>     </atraccion>
    <atraccion id="a_013" zona="z_oeste" intensidad="alta">
      <nombre>Duelo Mecánico</nombre>       <tipo>shooting ride</tipo>
      <alturaMinima>110</alturaMinima>
      <capacidad>20</capacidad>       <estado>operativa</estado>
      <tiempoEspera>16</tiempoEspera>     </atraccion>
    <atraccion id="a_013" zona="z_infantil" intensidad="baja">
      <nombre>Barquitos</nombre>       <tipo>agua</tipo>       <alturaMinima>75</alturaMinima>
      <capacidad>10</capacidad>       <estado>operativa</estado>
      <tiempoEspera>14</tiempoEspera>     </atraccion>
    <atraccion id="a_014" zona="z_infantil" intensidad="media">
      <nombre>Cohete Loco & sorpresa</nombre>
      <tipo>spin</tipo>       <alturaMinima>100</alturaMinima>
      <capacidad>18</capacidad>       <estado>operativa</estado>
      <tiempoEspera>19</tiempoEspera>     </atraccion>
    <atraccion id="a_015" zona="z_aventura" intensidad="alta">
      <nombre>Aventura Perdida</nombre>
      <tipo>jeep ride</tipo>       <alturaMinima>110</alturaMinima>
      <capacidad>32</capacidad>       <estado>operativa</estado>
      <tiempoEspera>33</tiempoEspera>       <premios>
        <premio>Top 10 del parque</premio>
      </premios>     </atraccion>     <atraccion id="a_016" zona="z_oeste">
      <nombre>Caballos del Oeste</nombre>
      <tipo>familiar</tipo>       <alturaMinima>85</alturaMinima>
      <capacidad>15</capacidad>       <estado>operativa</estado>
      <tiempoEspera>11</tiempoEspera>     </atraccion>   </atracciones>   <visitantes>
    <visitante id="v_001" vip="si" grupo="familia_rojas">
      <nombre>Lucía Rojas</nombre>       <edad>34</edad>
      <entradaAsignada>en_001</entradaAsignada>
      <atraccionesFavoritas>         <favorita>a_003</favorita>
        <favorita>a_004</favorita>       </atraccionesFavoritas>       <acompanantes>
        <acompanante>Mario Rojas</acompanante>
        <acompanante>Paula Rojas</acompanante>       </acompanantes>     </visitante>
    <visitante id="v_002" vip="no" grupo="colegio_1ESO">
      <nombre>Daniel Pérez</nombre>       <edad>13</edad>
      <entradaAsignada>en_002</entradaAsignada>
      <atraccionesFavoritas>         <favorita>a_010</favorita>
        <favorita>a_011</favorita>       </atraccionesFavoritas>     </visitante>
    <visitante id="v_003" vip="no">       <nombre>Marina Soler</nombre>       <edad>27</edad>
      <entradaAsignada>en_003</entradaAsignada>
    </visitante>     <visitante id="v_004" vip="talvez">
      <nombre>Álvaro Núñez</nombre>       <edad>29</edad>
      <entradaAsignada>en_004</entradaAsignada>
    </visitante>     <visitante id="v_005" vip="si">
      <nombre>Eva Torres</nombre>       <edad>31</edad>
      <entradaAsignada>en_005</entradaAsignada>
      <atraccionesFavoritas>         <favorita>a_001</favorita>
      </atraccionesFavoritas>       <acompanantes>
        <acompanante>Iván Torres</acompanante>       </acompanantes>     </visitante>
    <visitante id="v_006" vip="no" grupo="empresa_tecno">
      <nombre>Grupo Tech</nombre>       <edad>cuarenta</edad>
      <entradaAsignada>en_006</entradaAsignada>
    </visitante>     <visitante id="v_007" vip="no">
      <nombre>Rosa Vidal</nombre>       <edad>22</edad>
      <entradaAsignada></entradaAsignada>
    </visitante>     <visitante id="v_008" vip="no">
      <nombre>Pepe & Ana</nombre>       <edad>44</edad>
      <entradaAsignada>en_008</entradaAsignada>
    </visitante>     <visitante id="v_009" vip="si">
      <nombre>Sara Gil</nombre>       <edad>17</edad>
      <entradaAsignada>en_009</entradaAsignada>
      <atraccionesFavoritas>         <favorita>a_001</favorita>